{
  "schema_version": "h5-neutral-v1",
  "packet_id": "H4-289159bec29d",
  "mapping_sha256": "87b02bb333c5de0e8cc9315affc7a9e1f8a4d7dea48010295e054964ed213e40",
  "spans": {
    "P001": {
      "field": "inference",
      "block_index": 0,
      "sentence_index": 0,
      "kind": "paragraph",
      "text": "Inspect individual evaluator scores saved before consensus next.",
      "source_range": [
        0,
        64
      ]
    },
    "P002": {
      "field": "inference",
      "block_index": 0,
      "sentence_index": 1,
      "kind": "paragraph",
      "text": "Post-opening score changes favor H1 over H3.",
      "source_range": [
        65,
        109
      ]
    },
    "P003": {
      "field": "inference",
      "block_index": 0,
      "sentence_index": 2,
      "kind": "paragraph",
      "text": "Stable contemporaneous scores favor H3 over H1.",
      "source_range": [
        110,
        157
      ]
    },
    "P004": {
      "field": "inference",
      "block_index": 0,
      "sentence_index": 3,
      "kind": "paragraph",
      "text": "H1 and H3 remain live under the current evidence.",
      "source_range": [
        158,
        207
      ]
    }
  },
  "ambiguities": []
}
